{
  "schema_version": 1,
  "producer_type": "LOCAL_MODEL",
  "producer_id": "frozen-local-proposal-fixture",
  "model_version": "fixture-model@0.1.0",
  "method_version": "institutional-claim-extraction@0.1.0",
  "prompt_version": "institutional-claim-extraction-prompt@0.1.0",
  "claims": [
    {
      "subject_id": "geo_country_rus",
      "predicate": "real_gdp_growth_annual_pct",
      "object_value": {
        "value": "2.3",
        "unit": "percent_annual",
        "period": "2018"
      },
      "statement": "The report states that real GDP growth reached 2.3 percent in 2018.",
      "kind": "FACT",
      "relationship": "SUPPORTING",
      "source_fragments": [
        {
          "fragment_id": "frag_5841fa806888d481e3e9",
          "quote_hash": "sha256:5841fa806888d481e3e9e98455d4394b37fb29e57a2e9e12239c31a3606ddc89"
        }
      ],
      "assumptions": [],
      "unknowns": [
        "The excerpt does not provide a Moscow-specific property-market measure."
      ],
      "extraction_confidence": 0.98
    },
    {
      "subject_id": "opportunity_moscow_real_estate",
      "predicate": "national_forecast_local_market_limitation",
      "object_value": {
        "scope": "national_macro_context",
        "excluded_inference": "moscow_property_market_outcome"
      },
      "statement": "The national forecasts do not establish Moscow property-market conditions or a causal investment outcome.",
      "kind": "LIMITATION",
      "relationship": "ADVERSE",
      "source_fragments": [
        {
          "fragment_id": "frag_22ed248f6d0368c9242e",
          "quote_hash": "sha256:22ed248f6d0368c9242e2b88f98ed4169c499cbdd685c91a3130612aee6da96d"
        }
      ],
      "assumptions": [],
      "unknowns": [
        "No local transaction, yield, vacancy or regulatory evidence is present."
      ],
      "extraction_confidence": 0.99
    }
  ],
  "explicit_unknowns": [
    "The document does not establish current Moscow property prices.",
    "The document does not establish a causal investment return."
  ]
}
